{
  "id": "cargo-f82e5be0",
  "schemaVersion": "0.0.4",
  "ecosystem": "cargo",
  "category": "breaking",
  "project": {
    "url": "https://github.com/passy/revmenu",
    "organisation": "passy",
    "name": "revmenu"
  },
  "pr": {
    "url": "https://github.com/passy/revmenu/pull/21",
    "number": 21,
    "author": "dependabot-preview[bot]",
    "authorType": "bot",
    "botType": "dependabot",
    "merged": false,
    "mergedAt": null
  },
  "commits": {
    "pre": "c2e7ec6197e5e3f2665340abd92583b3584c5b85",
    "post": "f82e5be0c58177e8190c5a03647fffcc728b7d81",
    "preAuthorType": null,
    "postAuthorType": null
  },
  "update": {
    "dependencyName": "im",
    "previousVersion": "10.2.0",
    "newVersion": "12.3.1",
    "versionUpdateType": "major",
    "scope": "runtime"
  },
  "reproduction": {
    "fatImage": {
      "rustVersion": "1.56.0",
      "sourceDateEpoch": 1634860800,
      "aptSnapshot": "20211022T000000Z",
      "debianRelease": "buster",
      "expectedDigest": null
    },
    "buildFlags": [
      "--locked",
      "--offline"
    ],
    "environmentFingerprint": {
      "digest": "sha256:41bee9de457559640639b1c20c02ee818cb83f905a28fdd7d72d6f5b4cc531d2",
      "files": [
        {
          "path": "/manifest/packages.txt",
          "sha256": "a44e172f1526a8ee491f0fc84e3e9d1cad0dd0f49f883dddc948205a045f6807",
          "bytes": 14281
        },
        {
          "path": "/manifest/rustc.txt",
          "sha256": "11ce785eb504bd4339398ea79ecd9e0561b51e8263862242faf216ff9b22393c",
          "bytes": 197
        },
        {
          "path": "/manifest/cargo.txt",
          "sha256": "f1b6dc095e7a2e0bfdcf23ac4a87a82cbba0939003dd7602b515baa90d2c7385",
          "bytes": 130
        },
        {
          "path": "/manifest/os-release",
          "sha256": "c0c501c05a85ad53cbaf4028f75c078569dadda64ae8e793339096e05a3d98b0",
          "bytes": 261
        },
        {
          "path": "/manifest/sources.list",
          "sha256": "6276d04f06a6c89845ee90da74573982b84c69158662f20f1c0968ffbc44c661",
          "bytes": 319
        }
      ],
      "rustcVersion": "rustc 1.56.0 (09c42c458 2021-10-18)",
      "packageCount": 456
    },
    "thinImages": null,
    "verifiedOn": []
  },
  "failure": {
    "topCategory": "COMPILATION_FAILURE",
    "subCategory": "UNRESOLVED_IMPORT",
    "errorCodes": [
      "E0432",
      "unused_imports",
      "E0277"
    ]
  },
  "ecosystemMetadata": {},
  "unreproducibilityReason": null
}
