{
  "id": "cargo-0abf7148",
  "schemaVersion": "0.0.4",
  "ecosystem": "cargo",
  "category": "breaking",
  "project": {
    "url": "https://github.com/example-org/example-crate",
    "organisation": "example-org",
    "name": "example-crate"
  },
  "pr": {
    "url": "https://github.com/example-org/example-crate/pull/42",
    "number": 42,
    "author": "dependabot[bot]",
    "authorType": "bot",
    "botType": "dependabot",
    "merged": false,
    "mergedAt": null
  },
  "commits": {
    "pre": "b508900064878eb1ed55a53a724da2fe58f56ad0",
    "post": "0abf7148300f40a1da0538ab060552bca4a2f1d8",
    "preAuthorType": "human",
    "postAuthorType": "bot"
  },
  "update": {
    "dependencyName": "serde",
    "previousVersion": "1.0.150",
    "newVersion": "1.0.160",
    "versionUpdateType": "minor",
    "scope": "runtime"
  },
  "reproduction": {
    "fatImage": {
      "rustVersion": "1.75.0",
      "sourceDateEpoch": 1704067200,
      "aptSnapshot": "20240101T000000Z",
      "debianRelease": "bookworm",
      "expectedDigest": "sha256:0000000000000000000000000000000000000000000000000000000000000000"
    },
    "buildFlags": [
      "--locked",
      "--offline"
    ],
    "environmentFingerprint": {
      "digest": "sha256:1111111111111111111111111111111111111111111111111111111111111111",
      "files": [
        {
          "path": "/manifest/packages.txt",
          "sha256": "2222222222222222222222222222222222222222222222222222222222222222",
          "bytes": 20000
        },
        {
          "path": "/manifest/rustc.txt",
          "sha256": "3333333333333333333333333333333333333333333333333333333333333333",
          "bytes": 200
        }
      ],
      "rustcVersion": "rustc 1.75.0 (82e1608df 2023-12-21)",
      "packageCount": 700
    },
    "thinImages": {
      "expectedPre": "sha256:4444444444444444444444444444444444444444444444444444444444444444",
      "expectedPost": "sha256:5555555555555555555555555555555555555555555555555555555555555555"
    },
    "verifiedOn": [
      {
        "platform": "linux/amd64",
        "host": "example-ci",
        "verifiedAt": "2024-01-05T10:00:00Z",
        "fingerprintMatch": true,
        "fatImageDigestMatch": true,
        "outcomeMatch": true
      }
    ]
  },
  "failure": {
    "topCategory": "COMPILATION_FAILURE",
    "subCategory": "TRAIT_BOUND_NOT_SATISFIED",
    "errorCodes": [
      "E0277"
    ]
  },
  "ecosystemMetadata": {
    "edition": "2021",
    "cargoLockChanged": true,
    "transitivesChanged": 3
  },
  "unreproducibilityReason": null
}
